keyword,cluster,theme,intent,funnel,business_side,assigned_page,priority_hint
best color tattoo aftercare,aftercare,color-tattoo,BOFU-交易型,BOFU,B2C,blog/aftercare-color-tattoo,high
best for tattoo healing,aftercare,general,BOFU-交易型,BOFU,B2C,blog/tattoo-aftercare-guide,high
best tattoo aftercare,aftercare,general,BOFU-交易型,BOFU,B2C,blog/tattoo-aftercare-guide,high
best tattoo aftercare balm,aftercare,products,BOFU-交易型,BOFU,B2C,blog/aftercare-products,high
best tattoo aftercare cream,aftercare,products,BOFU-交易型,BOFU,B2C,blog/aftercare-products,high
best tattoo aftercare for sensitive skin,aftercare,sensitive-skin,BOFU-交易型,BOFU,B2C,blog/aftercare-sensitive-skin,high
best tattoo aftercare lotion,aftercare,products,BOFU-交易型,BOFU,B2C,blog/aftercare-products,high
best tattoo aftercare products,aftercare,general,BOFU-交易型,BOFU,B2C,blog/tattoo-aftercare-guide,high
best tattoo aftercare reddit,aftercare,issues,BOFU-交易型,BOFU,B2C,blog/aftercare-issues,high
best tattoo aftercare routine,aftercare,general,BOFU-交易型,BOFU,B2C,blog/tattoo-aftercare-guide,high
best tattoo aftercare soap,aftercare,products,BOFU-交易型,BOFU,B2C,blog/aftercare-products,high
best tattoo aftercare uk,aftercare,general,BOFU-交易型,BOFU,B2C,blog/tattoo-aftercare-guide,high
black and grey tattoo fresh vs healed,aftercare,black-grey,BOFU-交易型,BOFU,B2C,blog/aftercare-black-grey,high
color tattoo fresh vs healed,aftercare,color-tattoo,BOFU-交易型,BOFU,B2C,blog/aftercare-color-tattoo,high
fine line tattoo fresh vs healed,aftercare,general,BOFU-交易型,BOFU,B2C,blog/tattoo-aftercare-guide,high
tattoo aftercare bandage near me,aftercare,general,BOFU-交易型,BOFU,B2C,blog/tattoo-aftercare-guide,high
tattoo aftercare best products,aftercare,general,BOFU-交易型,BOFU,B2C,blog/tattoo-aftercare-guide,high
tattoo aftercare cream near me,aftercare,products,BOFU-交易型,BOFU,B2C,blog/aftercare-products,high
tattoo aftercare kit near me,aftercare,general,BOFU-交易型,BOFU,B2C,blog/tattoo-aftercare-guide,high
tattoo aftercare lubriderm vs aquaphor,aftercare,products,BOFU-交易型,BOFU,B2C,blog/aftercare-products,high
tattoo aftercare near me,aftercare,general,BOFU-交易型,BOFU,B2C,blog/tattoo-aftercare-guide,high
tattoo aftercare products near me,aftercare,general,BOFU-交易型,BOFU,B2C,blog/tattoo-aftercare-guide,high
tattoo blowout vs healing,aftercare,general,BOFU-交易型,BOFU,B2C,blog/tattoo-aftercare-guide,high
tattoo blowout vs healing smudge,aftercare,general,BOFU-交易型,BOFU,B2C,blog/tattoo-aftercare-guide,high
tattoo blowout vs normal healing,aftercare,general,BOFU-交易型,BOFU,B2C,blog/tattoo-aftercare-guide,high
tattoo healing cream near me,aftercare,products,BOFU-交易型,BOFU,B2C,blog/aftercare-products,high
tattoo healing good vs bad,aftercare,general,BOFU-交易型,BOFU,B2C,blog/tattoo-aftercare-guide,high
tattoo healing kit near me,aftercare,general,BOFU-交易型,BOFU,B2C,blog/tattoo-aftercare-guide,high
tattoo healing near me,aftercare,general,BOFU-交易型,BOFU,B2C,blog/tattoo-aftercare-guide,high
tattoo healing ointment near me,aftercare,products,BOFU-交易型,BOFU,B2C,blog/aftercare-products,high
tattoo healing vs blowout,aftercare,general,BOFU-交易型,BOFU,B2C,blog/tattoo-aftercare-guide,high
tattoo healing vs healed,aftercare,general,BOFU-交易型,BOFU,B2C,blog/tattoo-aftercare-guide,high
tattoo healing with saniderm vs without,aftercare,general,BOFU-交易型,BOFU,B2C,blog/tattoo-aftercare-guide,high
tattoo infection vs healing,aftercare,issues,BOFU-交易型,BOFU,B2C,blog/aftercare-issues,high
tattoo infection vs normal healing,aftercare,issues,BOFU-交易型,BOFU,B2C,blog/aftercare-issues,high
tattoo infection vs scab,aftercare,issues,BOFU-交易型,BOFU,B2C,blog/aftercare-issues,high
what tattoo aftercare is the best,aftercare,general,BOFU-交易型,BOFU,B2C,blog/tattoo-aftercare-guide,high
where to buy tattoo aftercare,aftercare,general,BOFU-交易型,BOFU,B2C,blog/tattoo-aftercare-guide,high
where to buy tattoo aftercare products,aftercare,general,BOFU-交易型,BOFU,B2C,blog/tattoo-aftercare-guide,high
which tattoo aftercare is best,aftercare,general,BOFU-交易型,BOFU,B2C,blog/tattoo-aftercare-guide,high
best black and grey tattoo artist philadelphia,color,general,BOFU-交易型,BOFU,B2B,blog/tattoo-color-guide,high
best black and grey tattoo artists,color,general,BOFU-交易型,BOFU,B2B,blog/tattoo-color-guide,high
best black and grey tattoo artists chicago,color,general,BOFU-交易型,BOFU,B2B,blog/tattoo-color-guide,high
best black and grey tattoo artists denver,color,general,BOFU-交易型,BOFU,B2B,blog/tattoo-color-guide,high
best black and grey tattoo artists in the us,color,general,BOFU-交易型,BOFU,B2B,blog/tattoo-color-guide,high
best black and grey tattoo artists in the world,color,general,BOFU-交易型,BOFU,B2B,blog/tattoo-color-guide,high
best black and grey tattoo artists london,color,general,BOFU-交易型,BOFU,B2B,blog/tattoo-color-guide,high
best black and grey tattoo artists near me,color,general,BOFU-交易型,BOFU,B2B,blog/tattoo-color-guide,high
best black and grey tattoo artists uk,color,general,BOFU-交易型,BOFU,B2B,blog/tattoo-color-guide,high
best black and grey tattoos,color,general,BOFU-交易型,BOFU,B2C,blog/tattoo-color-guide,high
best color for tattoo,color,general,BOFU-交易型,BOFU,B2C,blog/tattoo-color-guide,high
best color tattoo,color,general,BOFU-交易型,BOFU,B2C,blog/tattoo-color-guide,high
best color tattoo artist near me,color,general,BOFU-交易型,BOFU,B2B,blog/tattoo-color-guide,high
best color tattoo artists,color,general,BOFU-交易型,BOFU,B2B,blog/tattoo-color-guide,high
best color tattoo for dark skin,color,general,BOFU-交易型,BOFU,B2C,blog/tattoo-color-guide,high
best color tattoo ink,color,general,BOFU-交易型,BOFU,B2C,blog/tattoo-color-guide,high
best color tattoo ink brand,color,general,BOFU-交易型,BOFU,B2C,blog/tattoo-color-guide,high
best color tattoo ink for brown skin,color,general,BOFU-交易型,BOFU,B2C,blog/tattoo-color-guide,high
best color tattoo ink for dark skin,color,general,BOFU-交易型,BOFU,B2C,blog/tattoo-color-guide,high
best color tattoos near me,color,general,BOFU-交易型,BOFU,B2C,blog/tattoo-color-guide,high
best lotion for color tattoos,color,general,BOFU-交易型,BOFU,B2C,blog/tattoo-color-guide,high
black and grey tattoo artists near me,color,general,BOFU-交易型,BOFU,B2B,blog/tattoo-color-guide,high
black and grey tattoo near me,color,general,BOFU-交易型,BOFU,B2C,blog/tattoo-color-guide,high
black and grey tattoo vs black and white,color,general,BOFU-交易型,BOFU,B2C,blog/tattoo-color-guide,high
black and grey tattoo vs color,color,general,BOFU-交易型,BOFU,B2C,blog/tattoo-color-guide,high
black and grey tattoo vs line work,color,general,BOFU-交易型,BOFU,B2C,blog/tattoo-color-guide,high
black and grey tattoos near me,color,general,BOFU-交易型,BOFU,B2C,blog/tattoo-color-guide,high
color tattoo artists near me,color,general,BOFU-交易型,BOFU,B2B,blog/tattoo-color-guide,high
color tattoo near me,color,general,BOFU-交易型,BOFU,B2C,blog/tattoo-color-guide,high
color tattoo shops near me,color,general,BOFU-交易型,BOFU,B2B,blog/tattoo-color-guide,high
color tattoo specialist near me,color,general,BOFU-交易型,BOFU,B2C,blog/tattoo-color-guide,high
color tattoo vs,color,general,BOFU-交易型,BOFU,B2C,blog/tattoo-color-guide,high
color tattoo vs black,color,general,BOFU-交易型,BOFU,B2C,blog/tattoo-color-guide,high
color tattoo vs black and grey,color,general,BOFU-交易型,BOFU,B2C,blog/tattoo-color-guide,high
color tattoo vs black and grey reddit,color,general,BOFU-交易型,BOFU,B2C,blog/tattoo-color-guide,high
color tattoo vs black and white,color,general,BOFU-交易型,BOFU,B2C,blog/tattoo-color-guide,high
color tattoo vs black reddit,color,general,BOFU-交易型,BOFU,B2C,blog/tattoo-color-guide,high
coloured tattoo vs black,color,general,BOFU-交易型,BOFU,B2C,blog/tattoo-color-guide,high
what color tattoo is best for dark skin,color,general,BOFU-交易型,BOFU,B2C,blog/tattoo-color-guide,high
best tattoo cost,cost,general,BOFU-交易型,BOFU,B2C,blog/tattoo-cost-guide,high
best tattoo costa adeje,cost,general,BOFU-交易型,BOFU,B2C,blog/tattoo-cost-guide,high
best tattoo costa rica,cost,general,BOFU-交易型,BOFU,B2C,blog/tattoo-cost-guide,high
best tattoo price in abu dhabi,cost,general,BOFU-交易型,BOFU,B2C,blog/tattoo-cost-guide,high
best tattoo price in india,cost,by-location,BOFU-交易型,BOFU,B2C,blog/cost-by-location,high
best tattoo price in kanpur,cost,general,BOFU-交易型,BOFU,B2C,blog/tattoo-cost-guide,high
best tattoo price in siliguri,cost,general,BOFU-交易型,BOFU,B2C,blog/tattoo-cost-guide,high
best tattoo price in sri lanka,cost,general,BOFU-交易型,BOFU,B2C,blog/tattoo-cost-guide,high
best tattoo prices near me,cost,general,BOFU-交易型,BOFU,B2C,blog/tattoo-cost-guide,high
small tattoo cost near me,cost,by-size,BOFU-交易型,BOFU,B2C,blog/cost-by-size,high
small tattoo prices near me,cost,by-size,BOFU-交易型,BOFU,B2C,blog/cost-by-size,high
tattoo cost near me,cost,general,BOFU-交易型,BOFU,B2C,blog/tattoo-cost-guide,high
tattoo cover up prices near me,cost,general,BOFU-交易型,BOFU,B2C,blog/tattoo-cost-guide,high
tattoo price quotes near me,cost,general,BOFU-交易型,BOFU,B2C,blog/tattoo-cost-guide,high
tattoo removal cost near me,cost,general,BOFU-交易型,BOFU,B2C,blog/tattoo-cost-guide,high
tattoo removal near me cost,cost,general,BOFU-交易型,BOFU,B2C,blog/tattoo-cost-guide,high
tattoo removal prices near me,cost,general,BOFU-交易型,BOFU,B2C,blog/tattoo-cost-guide,high
best tattoo cover up artist,coverup,general,BOFU-交易型,BOFU,B2B,blog/tattoo-coverup-ideas,high
best tattoo cover up artist near me,coverup,general,BOFU-交易型,BOFU,B2B,blog/tattoo-coverup-ideas,high
best tattoo cover up makeup,coverup,general,BOFU-交易型,BOFU,B2C,blog/tattoo-coverup-ideas,high
best tattoo cover up makeup reddit,coverup,general,BOFU-交易型,BOFU,B2C,blog/tattoo-coverup-ideas,high
best tattoo cover up makeup waterproof,coverup,general,BOFU-交易型,BOFU,B2C,blog/tattoo-coverup-ideas,high
best tattoo cover up patches,coverup,general,BOFU-交易型,BOFU,B2C,blog/tattoo-coverup-ideas,high
best tattoo cover up tape,coverup,general,BOFU-交易型,BOFU,B2C,blog/tattoo-coverup-ideas,high
best tattoo cover ups,coverup,general,BOFU-交易型,BOFU,B2C,blog/tattoo-coverup-ideas,high
best tattoo cover ups near me,coverup,general,BOFU-交易型,BOFU,B2C,blog/tattoo-coverup-ideas,high
best tattoo fill ins,coverup,general,BOFU-交易型,BOFU,B2C,blog/tattoo-coverup-ideas,high
best tattoo fillers,coverup,general,BOFU-交易型,BOFU,B2C,blog/tattoo-coverup-ideas,high
best tattoo fillers for men,coverup,general,BOFU-交易型,BOFU,B2C,blog/tattoo-coverup-ideas,high
best tattoo fillers for women,coverup,general,BOFU-交易型,BOFU,B2C,blog/tattoo-coverup-ideas,high
best tattoo gap fillers,coverup,general,BOFU-交易型,BOFU,B2C,blog/tattoo-coverup-ideas,high
lip tattoo vs filler,coverup,general,BOFU-交易型,BOFU,B2C,blog/tattoo-coverup-ideas,high
tattoo cover up app,coverup,general,MOFU-商业型,MOFU,B2C,blog/tattoo-coverup-ideas,high
tattoo cover up app free,coverup,general,BOFU-交易型,BOFU,B2C,blog/tattoo-coverup-ideas,high
tattoo cover up artists near me,coverup,general,BOFU-交易型,BOFU,B2B,blog/tattoo-coverup-ideas,high
tattoo cover up experts near me,coverup,general,BOFU-交易型,BOFU,B2C,blog/tattoo-coverup-ideas,high
tattoo cover up makeup near me,coverup,general,BOFU-交易型,BOFU,B2C,blog/tattoo-coverup-ideas,high
tattoo cover up near me,coverup,general,BOFU-交易型,BOFU,B2C,blog/tattoo-coverup-ideas,high
tattoo cover up patches near me,coverup,general,BOFU-交易型,BOFU,B2C,blog/tattoo-coverup-ideas,high
tattoo cover up shops near me,coverup,general,BOFU-交易型,BOFU,B2B,blog/tattoo-coverup-ideas,high
tattoo cover up specialist near me,coverup,general,BOFU-交易型,BOFU,B2C,blog/tattoo-coverup-ideas,high
tattoo cover up tape near me,coverup,general,BOFU-交易型,BOFU,B2C,blog/tattoo-coverup-ideas,high
tattoo cover up vs blast over,coverup,general,BOFU-交易型,BOFU,B2C,blog/tattoo-coverup-ideas,high
tattoo cover up vs rework,coverup,general,BOFU-交易型,BOFU,B2C,blog/tattoo-coverup-ideas,high
tattoo filler app,coverup,general,MOFU-商业型,MOFU,B2C,blog/tattoo-coverup-ideas,high
tattoo refill near me,coverup,general,BOFU-交易型,BOFU,B2C,blog/tattoo-coverup-ideas,high
what tattoo cover up is the best,coverup,general,BOFU-交易型,BOFU,B2C,blog/tattoo-coverup-ideas,high
what's the best tattoo cover up makeup,coverup,general,BOFU-交易型,BOFU,B2C,blog/tattoo-coverup-ideas,high
where to buy tattoo cover up,coverup,general,BOFU-交易型,BOFU,B2C,blog/tattoo-coverup-ideas,high
best meaningful tattoo ideas,ideas,meaningful,BOFU-交易型,BOFU,B2C,blog/ideas-meaningful,high
best meaningful tattoo ideas for men,ideas,for-men,BOFU-交易型,BOFU,B2C,blog/ideas-for-men,high
best tattoo cover up ideas,ideas,general,BOFU-交易型,BOFU,B2C,blog/tattoo-ideas-guide,high
best tattoo designs,ideas,general,BOFU-交易型,BOFU,B2C,blog/tattoo-ideas-guide,high
best tattoo designs for men,ideas,for-men,BOFU-交易型,BOFU,B2C,blog/ideas-for-men,high
best tattoo designs for men small,ideas,for-men,BOFU-交易型,BOFU,B2C,blog/ideas-for-men,high
best tattoo designs for men with meaning,ideas,for-men,BOFU-交易型,BOFU,B2C,blog/ideas-for-men,high
best tattoo designs for women,ideas,for-women,BOFU-交易型,BOFU,B2C,blog/ideas-for-women,high
best tattoo filler designs,ideas,general,BOFU-交易型,BOFU,B2C,blog/tattoo-ideas-guide,high
best tattoo filler ideas,ideas,general,BOFU-交易型,BOFU,B2C,blog/tattoo-ideas-guide,high
best tattoo filler ideas for men,ideas,for-men,BOFU-交易型,BOFU,B2C,blog/ideas-for-men,high
tattoo designs app,ideas,general,MOFU-商业型,MOFU,B2C,blog/tattoo-ideas-guide,high
tattoo designs near me,ideas,general,BOFU-交易型,BOFU,B2C,blog/tattoo-ideas-guide,high
tattoo ideas app,ideas,general,MOFU-商业型,MOFU,B2C,blog/tattoo-ideas-guide,high
tattoo ideas near me,ideas,general,BOFU-交易型,BOFU,B2C,blog/tattoo-ideas-guide,high
what are the best tattoo ideas,ideas,general,BOFU-交易型,BOFU,B2C,blog/tattoo-ideas-guide,high
tattoo words near me,other,general,BOFU-交易型,BOFU,B2C,blog/tattoo-guide,high
best painless tattoo cream,pain,reduction,BOFU-交易型,BOFU,B2C,blog/pain-reduction,high
best painless tattoo numbing cream,pain,reduction,BOFU-交易型,BOFU,B2C,blog/pain-reduction,high
best tattoo pain,pain,general,BOFU-交易型,BOFU,B2C,blog/tattoo-pain-guide,high
best tattoo pain chart,pain,chart,BOFU-交易型,BOFU,B2C,blog/pain-chart,high
best tattoo pain cream,pain,general,BOFU-交易型,BOFU,B2C,blog/tattoo-pain-guide,high
best tattoo pain killer,pain,general,BOFU-交易型,BOFU,B2C,blog/tattoo-pain-guide,high
best tattoo pain numbing cream,pain,reduction,BOFU-交易型,BOFU,B2C,blog/pain-reduction,high
best tattoo pain relief,pain,general,BOFU-交易型,BOFU,B2C,blog/tattoo-pain-guide,high
best tattoo pain relief cream,pain,general,BOFU-交易型,BOFU,B2C,blog/tattoo-pain-guide,high
best tattoo paint,pain,general,BOFU-交易型,BOFU,B2C,blog/tattoo-pain-guide,high
no tattoo pain green 80 reviews,pain,general,BOFU-交易型,BOFU,B2C,blog/tattoo-pain-guide,high
tattoo pain chart men vs women,pain,chart,BOFU-交易型,BOFU,B2C,blog/pain-chart,high
tattoo pain compared to other pain,pain,general,BOFU-交易型,BOFU,B2C,blog/tattoo-pain-guide,high
tattoo pain comparison,pain,general,BOFU-交易型,BOFU,B2C,blog/tattoo-pain-guide,high
tattoo pain green 80 review,pain,general,BOFU-交易型,BOFU,B2C,blog/tattoo-pain-guide,high
tattoo pain management,pain,for-men,MOFU-商业型,MOFU,B2B,blog/pain-for-men,high
tattoo pain management tips,pain,for-men,MOFU-商业型,MOFU,B2B,blog/pain-for-men,high
tattoo pain numbing cream near me,pain,reduction,BOFU-交易型,BOFU,B2C,blog/pain-reduction,high
tattoo pain vs childbirth,pain,general,BOFU-交易型,BOFU,B2C,blog/tattoo-pain-guide,high
tattoo pain vs epilating,pain,general,BOFU-交易型,BOFU,B2C,blog/tattoo-pain-guide,high
tattoo pain vs getting blood drawn,pain,general,BOFU-交易型,BOFU,B2C,blog/tattoo-pain-guide,high
tattoo pain vs laser hair removal,pain,general,BOFU-交易型,BOFU,B2C,blog/tattoo-pain-guide,high
tattoo pain vs piercing pain,pain,general,BOFU-交易型,BOFU,B2C,blog/tattoo-pain-guide,high
what can tattoo pain be compared to,pain,general,BOFU-交易型,BOFU,B2C,blog/tattoo-pain-guide,high
app for tattoo placement,placement,for-men,MOFU-商业型,MOFU,B2C,blog/placement-for-men,high
best meaningful tattoo in hand,placement,meaning,BOFU-交易型,BOFU,B2C,blog/placement-meaning,high
best tattoo designs for men arm,placement,ideas,BOFU-交易型,BOFU,B2C,blog/placement-ideas,high
best tattoo designs for men hand,placement,ideas,BOFU-交易型,BOFU,B2C,blog/placement-ideas,high
best tattoo placement for aging,placement,for-men,BOFU-交易型,BOFU,B2C,blog/placement-for-men,high
best tattoo placement for first time,placement,for-men,BOFU-交易型,BOFU,B2C,blog/placement-for-men,high
best tattoo placement for men,placement,for-men,BOFU-交易型,BOFU,B2C,blog/placement-for-men,high
best tattoo placement for plus size women,placement,for-women,BOFU-交易型,BOFU,B2C,blog/placement-for-women,high
best tattoo placement for quotes,placement,for-men,BOFU-交易型,BOFU,B2C,blog/placement-for-men,high
best tattoo placement for small tattoos,placement,for-men,BOFU-交易型,BOFU,B2C,blog/placement-for-men,high
best tattoo placement for weight loss,placement,for-men,BOFU-交易型,BOFU,B2C,blog/placement-for-men,high
best tattoo placement for women,placement,for-women,BOFU-交易型,BOFU,B2C,blog/placement-for-women,high
best tattoo placement for women small,placement,for-women,BOFU-交易型,BOFU,B2C,blog/placement-for-women,high
best tattoo placement for words,placement,for-men,BOFU-交易型,BOFU,B2C,blog/placement-for-men,high
best tattoo placements,placement,for-men,BOFU-交易型,BOFU,B2C,blog/placement-for-men,high
best tattoo quotes on hand,placement,hand,BOFU-交易型,BOFU,B2C,blog/placement-hand,high
tattoo placement app,placement,for-men,MOFU-商业型,MOFU,B2C,blog/placement-for-men,high
tattoo placement app free,placement,for-men,BOFU-交易型,BOFU,B2C,blog/placement-for-men,high
tattoo placement then vs now,placement,for-men,BOFU-交易型,BOFU,B2C,blog/placement-for-men,high
where is the best tattoo placement,placement,for-men,BOFU-交易型,BOFU,B2C,blog/placement-for-men,high
best tattoo preparation,prep,general,BOFU-交易型,BOFU,B2C,blog/tattoo-prep-guide,high
tattoo appointment prep reddit,prep,general,MOFU-商业型,MOFU,B2B,blog/tattoo-prep-guide,high
tattoo appointment preparation,prep,general,MOFU-商业型,MOFU,B2B,blog/tattoo-prep-guide,high
tattoo preparation for artists,prep,for-artists,MOFU-商业型,MOFU,B2B,blog/prep-for-artists,high
tattoo skin preparation for artists,prep,for-artists,MOFU-商业型,MOFU,B2B,blog/prep-for-artists,high
best antibiotic cream for tattoo infection,problems,infection,BOFU-交易型,BOFU,B2C,blog/problems-infection,high
best antibiotic cream for tattoo infection reddit,problems,infection,BOFU-交易型,BOFU,B2C,blog/problems-infection,high
best antibiotic for tattoo infection,problems,infection,BOFU-交易型,BOFU,B2C,blog/problems-infection,high
best antibiotic ointment for tattoo infection,problems,infection,BOFU-交易型,BOFU,B2C,blog/problems-infection,high
best medicine for tattoo infection,problems,infection,BOFU-交易型,BOFU,B2C,blog/problems-infection,high
best ointment for tattoo infection,problems,infection,BOFU-交易型,BOFU,B2C,blog/problems-infection,high
best tattoo infection cream,problems,infection,BOFU-交易型,BOFU,B2C,blog/problems-infection,high
best thing for tattoo infection,problems,infection,BOFU-交易型,BOFU,B2C,blog/problems-infection,high
best way to prevent tattoo infection,problems,infection,BOFU-交易型,BOFU,B2C,blog/problems-infection,high
best way to treat tattoo infection,problems,infection,BOFU-交易型,BOFU,B2C,blog/problems-infection,high
tattoo blowout fix near me,problems,blowout,BOFU-交易型,BOFU,B2C,blog/problems-blowout,high
tattoo blowout vs aging,problems,blowout,BOFU-交易型,BOFU,B2C,blog/problems-blowout,high
tattoo blowout vs bruise,problems,blowout,BOFU-交易型,BOFU,B2C,blog/problems-blowout,high
tattoo blowout vs infection,problems,blowout,BOFU-交易型,BOFU,B2C,blog/problems-blowout,high
tattoo blowout vs ink drift,problems,blowout,BOFU-交易型,BOFU,B2C,blog/problems-blowout,high
tattoo blowout vs migration,problems,blowout,BOFU-交易型,BOFU,B2C,blog/problems-blowout,high
tattoo blowout vs normal,problems,blowout,BOFU-交易型,BOFU,B2C,blog/problems-blowout,high
tattoo blowout vs smudge,problems,blowout,BOFU-交易型,BOFU,B2C,blog/problems-blowout,high
tattoo infection management,problems,infection,MOFU-商业型,MOFU,B2B,blog/problems-infection,high
tattoo infection vs allergic reaction,problems,infection,BOFU-交易型,BOFU,B2C,blog/problems-infection,high
tattoo infection vs allergy,problems,infection,BOFU-交易型,BOFU,B2C,blog/problems-infection,high
tattoo infection vs bruising,problems,infection,BOFU-交易型,BOFU,B2C,blog/problems-infection,high
tattoo infection vs irritation,problems,infection,BOFU-交易型,BOFU,B2C,blog/problems-infection,high
tattoo infection vs overworked,problems,infection,BOFU-交易型,BOFU,B2C,blog/problems-infection,high
tattoo infection vs rash,problems,infection,BOFU-交易型,BOFU,B2C,blog/problems-infection,high
best tattoo quotes,quotes,general,BOFU-交易型,BOFU,B2C,blog/tattoo-quotes-guide,high
best tattoo quotes ever,quotes,general,BOFU-交易型,BOFU,B2C,blog/tattoo-quotes-guide,high
best tattoo quotes for men,quotes,general,BOFU-交易型,BOFU,B2C,blog/tattoo-quotes-guide,high
best tattoo quotes for men small,quotes,general,BOFU-交易型,BOFU,B2C,blog/tattoo-quotes-guide,high
best tattoo quotes for men with meaning,quotes,general,BOFU-交易型,BOFU,B2C,blog/tattoo-quotes-guide,high
best tattoo quotes for women,quotes,general,BOFU-交易型,BOFU,B2C,blog/tattoo-quotes-guide,high
best tattoo quotes for women with meaning,quotes,general,BOFU-交易型,BOFU,B2C,blog/tattoo-quotes-guide,high
best tattoo quotes in hindi,quotes,general,BOFU-交易型,BOFU,B2C,blog/tattoo-quotes-guide,high
best tattoo quotes in sanskrit,quotes,general,BOFU-交易型,BOFU,B2C,blog/tattoo-quotes-guide,high
best tattoo quotes with meaning,quotes,general,BOFU-交易型,BOFU,B2C,blog/tattoo-quotes-guide,high
tattoo quotes near me,quotes,general,BOFU-交易型,BOFU,B2C,blog/tattoo-quotes-guide,high
what are the best tattoo quotes,quotes,general,BOFU-交易型,BOFU,B2C,blog/tattoo-quotes-guide,high
color tattoo removal near me,removal,general,BOFU-交易型,BOFU,B2C,blog/tattoo-removal-guide,high
small tattoo removal near me,removal,general,BOFU-交易型,BOFU,B2C,blog/tattoo-removal-guide,high
tattoo blowout removal near me,removal,general,BOFU-交易型,BOFU,B2C,blog/tattoo-removal-guide,high
tattoo cover up vs removal,removal,general,BOFU-交易型,BOFU,B2C,blog/tattoo-removal-guide,high
tattoo removal for free near me,removal,general,BOFU-交易型,BOFU,B2C,blog/tattoo-removal-guide,high
tattoo removal jobs near me,removal,general,BOFU-交易型,BOFU,B2C,blog/tattoo-removal-guide,high
tattoo removal near me,removal,general,BOFU-交易型,BOFU,B2C,blog/tattoo-removal-guide,high
tattoo removal near me open now,removal,general,BOFU-交易型,BOFU,B2C,blog/tattoo-removal-guide,high
tattoo removal near me within 20 mi,removal,general,BOFU-交易型,BOFU,B2C,blog/tattoo-removal-guide,high
tattoo removal near me within 5 mi,removal,general,BOFU-交易型,BOFU,B2C,blog/tattoo-removal-guide,high
tattoo removal reviews,removal,general,BOFU-交易型,BOFU,B2C,blog/tattoo-removal-guide,high
tattoo removal shop near me,removal,general,BOFU-交易型,BOFU,B2B,blog/tattoo-removal-guide,high
tattoo removal tool,removal,general,MOFU-商业型,MOFU,B2C,blog/tattoo-removal-guide,high
tattoo removal training near me,removal,general,BOFU-交易型,BOFU,B2C,blog/tattoo-removal-guide,high
tattoo removal vs cover up,removal,general,BOFU-交易型,BOFU,B2C,blog/tattoo-removal-guide,high
tattoo remove 88 katy reviews,removal,general,BOFU-交易型,BOFU,B2C,blog/tattoo-removal-guide,high
best fine line tattoo artist brisbane,small,general,BOFU-交易型,BOFU,B2B,blog/small-tattoo-ideas,high
best fine line tattoo artists,small,general,BOFU-交易型,BOFU,B2B,blog/small-tattoo-ideas,high
best fine line tattoo artists london,small,general,BOFU-交易型,BOFU,B2B,blog/small-tattoo-ideas,high
best fine line tattoo artists near me,small,general,BOFU-交易型,BOFU,B2B,blog/small-tattoo-ideas,high
best fine line tattoo artists nyc,small,general,BOFU-交易型,BOFU,B2B,blog/small-tattoo-ideas,high
best fine line tattoo artists singapore,small,general,BOFU-交易型,BOFU,B2B,blog/small-tattoo-ideas,high
best fine line tattoo bali,small,general,BOFU-交易型,BOFU,B2C,blog/small-tattoo-ideas,high
best fine line tattoos,small,general,BOFU-交易型,BOFU,B2C,blog/small-tattoo-ideas,high
best fine line tattoos near me,small,general,BOFU-交易型,BOFU,B2C,blog/small-tattoo-ideas,high
best fine line tattoos perth,small,general,BOFU-交易型,BOFU,B2C,blog/small-tattoo-ideas,high
fine line tattoo artists near me,small,general,BOFU-交易型,BOFU,B2B,blog/small-tattoo-ideas,high
fine line tattoo course near me,small,general,BOFU-交易型,BOFU,B2C,blog/small-tattoo-ideas,high
fine line tattoo jacksonville reviews,small,general,BOFU-交易型,BOFU,B2C,blog/small-tattoo-ideas,high
fine line tattoo near me,small,general,BOFU-交易型,BOFU,B2C,blog/small-tattoo-ideas,high
