keyword,cluster,theme,intent,funnel,business_side,assigned_page,priority_hint
fine line tattoo near me within 8.1 km,small,general,BOFU-交易型,BOFU,B2C,blog/small-tattoo-ideas,high
fine line tattoo shop near me,small,general,BOFU-交易型,BOFU,B2B,blog/small-tattoo-ideas,high
fine line tattoo shops near me,small,general,BOFU-交易型,BOFU,B2B,blog/small-tattoo-ideas,high
fine line tattoo specialist near me,small,general,BOFU-交易型,BOFU,B2C,blog/small-tattoo-ideas,high
fine line tattoo touch up near me,small,general,BOFU-交易型,BOFU,B2C,blog/small-tattoo-ideas,high
fine line tattoo training near me,small,general,BOFU-交易型,BOFU,B2C,blog/small-tattoo-ideas,high
fine line tattoo vs regular,small,general,BOFU-交易型,BOFU,B2C,blog/small-tattoo-ideas,high
fine line tattoo vs single needle,small,general,BOFU-交易型,BOFU,B2C,blog/small-tattoo-ideas,high
fine line tattoo walk in near me,small,general,BOFU-交易型,BOFU,B2C,blog/small-tattoo-ideas,high
fine line vs thick line tattoo,small,general,BOFU-交易型,BOFU,B2C,blog/small-tattoo-ideas,high
how much are small tattoos near me,small,general,BOFU-交易型,BOFU,B2C,blog/small-tattoo-ideas,high
route 66 fine line tattoo reviews,small,general,BOFU-交易型,BOFU,B2C,blog/small-tattoo-ideas,high
small tattoo artists near me,small,general,BOFU-交易型,BOFU,B2B,blog/small-tattoo-ideas,high
small tattoo near me,small,general,BOFU-交易型,BOFU,B2C,blog/small-tattoo-ideas,high
small tattoo shops near me,small,general,BOFU-交易型,BOFU,B2B,blog/small-tattoo-ideas,high
what is the best small tattoo for men,small,for-men,BOFU-交易型,BOFU,B2C,blog/small-for-men,high
what small tattoo should i get,small,general,BOFU-交易型,BOFU,B2C,blog/small-tattoo-ideas,high
best black and grey realism tattoo artists,styles,blackwork,BOFU-交易型,BOFU,B2B,blog/styles-blackwork,high
best tattoo styles,styles,general,BOFU-交易型,BOFU,B2C,blog/tattoo-styles-guide,high
best tattoo styles and their origins,styles,general,BOFU-交易型,BOFU,B2C,blog/tattoo-styles-guide,high
best tattoo styles for black skin,styles,general,BOFU-交易型,BOFU,B2C,blog/tattoo-styles-guide,high
best tattoo styles for body hair,styles,general,BOFU-交易型,BOFU,B2C,blog/tattoo-styles-guide,high
best tattoo styles for cover up,styles,general,BOFU-交易型,BOFU,B2C,blog/tattoo-styles-guide,high
best tattoo styles for dark skin,styles,general,BOFU-交易型,BOFU,B2C,blog/tattoo-styles-guide,high
best tattoo styles for longevity,styles,general,BOFU-交易型,BOFU,B2C,blog/tattoo-styles-guide,high
best tattoo styles for men,styles,general,BOFU-交易型,BOFU,B2C,blog/tattoo-styles-guide,high
best tattoo styles reddit,styles,general,BOFU-交易型,BOFU,B2C,blog/tattoo-styles-guide,high
best tattoo styles that age well,styles,general,BOFU-交易型,BOFU,B2C,blog/tattoo-styles-guide,high
black and grey tattoo vs blackwork,styles,blackwork,BOFU-交易型,BOFU,B2C,blog/styles-blackwork,high
black and grey tattoo vs realism,styles,blackwork,BOFU-交易型,BOFU,B2C,blog/styles-blackwork,high
tattoo styles bedfordview reviews,styles,general,BOFU-交易型,BOFU,B2C,blog/tattoo-styles-guide,high
tattoo styles cresta reviews,styles,general,BOFU-交易型,BOFU,B2C,blog/tattoo-styles-guide,high
tattoo styles jansen park reviews,styles,general,BOFU-交易型,BOFU,B2C,blog/tattoo-styles-guide,high
tattoo styles menlyn reviews,styles,general,BOFU-交易型,BOFU,B2C,blog/tattoo-styles-guide,high
tattoo styles reviews,styles,general,BOFU-交易型,BOFU,B2C,blog/tattoo-styles-guide,high
tattoo styles that age the best,styles,general,BOFU-交易型,BOFU,B2C,blog/tattoo-styles-guide,high
what tattoo styles age the best,styles,general,BOFU-交易型,BOFU,B2C,blog/tattoo-styles-guide,high
best tattoo trends,trends,general,BOFU-交易型,BOFU,B2C,blog/tattoo-trends-guide,high
tattoo trends bengaluru reviews,trends,general,BOFU-交易型,BOFU,B2C,blog/tattoo-trends-guide,high
tattoo trends reviews,trends,general,BOFU-交易型,BOFU,B2C,blog/tattoo-trends-guide,high
